metric_group,metric,year,value,unit,notes
Total expenditures,Total AFA expenditures,2023-24,25.869,million CAD,All program and operating expenses
Program expenditures,Grant programs expenditures,2023-24,23.1,million CAD,Included in total expenditures
Program expenditures,Art Collection expenditures,2023-24,2.1,million CAD,Included in total expenditures
Program expenditures,Administration expenditures,2023-24,0.6,million CAD,Included in total expenditures
Funding by recipient,Funding awarded to organizations,2023-24,19.4,million CAD,Excludes program support expenses
Funding by recipient,Funding awarded to individuals,2023-24,2.7,million CAD,Excludes program support expenses
EDIA funding,Funding approved for EDIA arts projects (Organization Activation Projects),2023-24,0.197,million CAD,"Equity, diversity, inclusion and accessibility projects"
Donations placeholder,Budget placeholder for unencumbered donations (Arts Sector Donation Program),2023-24,1,million CAD,Budgeted line; no donations received
Future projection (policy),Projected AFA funding by 2026–27,2026-27,39.1,million CAD,From Alberta Arts Programming / policy context